<?xml version="1.0" encoding="UTF-8"?>
<!DOCTYPE httphelper-config SYSTEM "httphelper-config.dtd">
<httphelper-config>
    <httpclient-config>
        <http charset="utf-8" connection-timeout="15000" socket-timeout="15000"/>
        <pool QueueCapacity="150" MaxPoolSize="100" CorePoolSize="50" KeepAliveSeconds="300"/>
    </httpclient-config>
    <default-handlers>
        <pre>
            <handler type="init" clazz="com.jeasy.httphelper.request.handler.impl.pre.DefaultInitHandlerImpl"/>
            <handler type="parameter" clazz="com.jeasy.httphelper.request.handler.impl.pre.DefaultParameterBuliderHandlerImpl"/>
            <handler type="url" clazz="com.jeasy.httphelper.request.handler.impl.pre.DefaultUrlBuilderHandlerImpl"/>
            <handler type="validation" clazz="com.jeasy.httphelper.request.handler.impl.pre.DefaultValidationHandlerImpl"/>
        </pre>
        <pro>
            <handler type="parse" clazz="com.jeasy.httphelper.request.handler.impl.pro.DefaultResultParseHandlerImpl"/>
        </pro>
    </default-handlers>
</httphelper-config>
